{
  "schema_version": 1,
  "capabilities": [
    {"capability_id":"core.files.read","purpose":"read workspace files","access":"read","operations":["read"],"providers":[{"provider":"codex-read","profile":"core","access":"read","enabled_by_default":true,"environments":["claude","codex"],"availability":"available"}],"fallback":["report missing or unreadable file"],"escalation":"use fallback and hand off when unavailable","verification":{"status":"live","evidence":"Codex built-in tool"}},
    {"capability_id":"core.files.write","purpose":"write workspace files","access":"write","operations":["write"],"providers":[{"provider":"codex-write-edit","profile":"core","access":"write","enabled_by_default":true,"environments":["claude","codex"],"availability":"available"}],"fallback":["return patch plan if write permission is absent"],"escalation":"use fallback and hand off when unavailable","verification":{"status":"live","evidence":"Codex built-in tool"}},
    {"capability_id":"core.shell.execute","purpose":"run local verification commands","access":"execute","operations":["execute","validate"],"providers":[{"provider":"codex-shell","profile":"core","access":"execute","enabled_by_default":true,"environments":["claude","codex"],"availability":"available"}],"fallback":["report command unavailable"],"escalation":"use fallback and hand off when unavailable","verification":{"status":"live","evidence":"Codex built-in tool"}},
    {"capability_id":"web.search","purpose":"search public web sources","access":"read","operations":["search"],"providers":[{"provider":"web-access","profile":"web","access":"read","enabled_by_default":false,"environments":["claude","codex"],"availability":"on-demand"}],"fallback":["state that source was not verified"],"escalation":"use fallback and hand off when unavailable","verification":{"status":"static"}},
    {"capability_id":"web.fetch","purpose":"fetch a known web resource","access":"read","operations":["read"],"providers":[{"provider":"web-access","profile":"web","access":"read","enabled_by_default":false,"environments":["claude","codex"],"availability":"on-demand"}],"fallback":["use supplied local source"],"escalation":"use fallback and hand off when unavailable","verification":{"status":"static"}},
    {"capability_id":"web.extract","purpose":"extract web page content","access":"read","operations":["read"],"providers":[{"provider":"web-access","profile":"web","access":"read","enabled_by_default":false,"environments":["claude","codex"],"availability":"on-demand"}],"fallback":["use fetch output without extraction"],"escalation":"use fallback and hand off when unavailable","verification":{"status":"static"}},
    {"capability_id":"web.browser.interact","purpose":"inspect an interactive web page","access":"execute","operations":["read","execute"],"providers":[{"provider":"browser","profile":"web","access":"execute","enabled_by_default":false,"environments":["claude","codex"],"availability":"on-demand"}],"fallback":["return reproducible manual steps"],"escalation":"use fallback and hand off when unavailable","verification":{"status":"static"}},
    {"capability_id":"document.word.read","purpose":"read and inspect DOCX","access":"read","operations":["read","validate"],"providers":[{"provider":"documents","profile":"documents","access":"read","enabled_by_default":false,"environments":["claude","codex"],"availability":"on-demand"},{"provider":"word-mcp","profile":"documents","access":"read","enabled_by_default":false,"environments":["claude","codex"],"availability":"on-demand"}],"fallback":["use python-docx only when available"],"escalation":"use fallback and hand off when unavailable","verification":{"status":"forward-test","evidence":"Epic 5: Word MCP 3.4.4 protocol read passed; current Desktop session needs restart to expose newly registered MCP"}},
    {"capability_id":"document.word.write","purpose":"create or edit DOCX","access":"write","operations":["write","render","validate"],"providers":[{"provider":"documents","profile":"documents","access":"write","enabled_by_default":false,"environments":["claude","codex"],"availability":"on-demand"},{"provider":"word-mcp","profile":"documents","access":"write","enabled_by_default":false,"environments":["claude","codex"],"availability":"on-demand"}],"fallback":["return source content and report missing document runtime"],"escalation":"use fallback and hand off when unavailable","verification":{"status":"forward-test","evidence":"Epic 5: controlled search-and-replace on temporary copy only; broad Word edit remains unverified"}},
    {"capability_id":"spreadsheet.read","purpose":"read and validate spreadsheet data","access":"read","operations":["read","validate"],"providers":[{"provider":"spreadsheets","profile":"documents","access":"read","enabled_by_default":false,"environments":["claude","codex"],"availability":"on-demand"},{"provider":"excel-mcp","profile":"documents","access":"read","enabled_by_default":false,"environments":["claude","codex"],"availability":"on-demand"}],"fallback":["use openpyxl only when available"],"escalation":"use fallback and hand off when unavailable","verification":{"status":"forward-test","evidence":"Epic 5: excel-mcp 1.28.1 read passed; native Codex document-control session was not connected"}},
    {"capability_id":"spreadsheet.write","purpose":"create or edit spreadsheets","access":"write","operations":["write","validate"],"providers":[{"provider":"spreadsheets","profile":"documents","access":"write","enabled_by_default":false,"environments":["claude","codex"],"availability":"on-demand"},{"provider":"excel-mcp","profile":"documents","access":"write","enabled_by_default":false,"environments":["claude","codex"],"availability":"on-demand"}],"fallback":["return change plan and report missing spreadsheet runtime"],"escalation":"use fallback and hand off when unavailable","verification":{"status":"forward-test","evidence":"Epic 5: write tools are listed but no MCP write test is accepted"}},
    {"capability_id":"pdf.read","purpose":"read PDF structure and text","access":"read","operations":["read","validate"],"providers":[{"provider":"pdf","profile":"documents","access":"read","enabled_by_default":false,"environments":["claude","codex"],"availability":"on-demand"},{"provider":"pdf-mcp","profile":"documents","access":"read","enabled_by_default":false,"environments":["claude","codex"],"availability":"on-demand"}],"fallback":["report missing PDF reader"],"escalation":"use fallback and hand off when unavailable","verification":{"status":"forward-test","evidence":"Epic 5: pdf-mcp 1.20.0 read passed; native PDF document-control surface is absent"}},
    {"capability_id":"pdf.render","purpose":"render PDF for visual review","access":"read","operations":["render","validate"],"providers":[{"provider":"pdf","profile":"documents","access":"read","enabled_by_default":false,"environments":["claude","codex"],"availability":"on-demand"},{"provider":"pdf-mcp","profile":"documents","access":"read","enabled_by_default":false,"environments":["claude","codex"],"availability":"on-demand"}],"fallback":["report visual verification unavailable"],"escalation":"use fallback and hand off when unavailable","verification":{"status":"forward-test","evidence":"Epic 5: PDF read passed; render and PDF-object edit remain unverified"}},
    {"capability_id":"revit.inspect","purpose":"inspect a live Revit model","access":"read","operations":["read"],"providers":[{"provider":"Revit-Connector","profile":"Revit/AutoCAD","access":"read","enabled_by_default":false,"environments":["claude","codex"],"availability":"on-demand"}],"fallback":["request exported model evidence or enable on-demand bridge"],"escalation":"use fallback and hand off when unavailable","verification":{"status":"live","evidence":"Epic 3.1: Codex Desktop runtime single-server read-only get_revit_status passed after manual restart; direct bridge passed; Desktop Import UI, CLI, and IDE not tested"}},
    {"capability_id":"revit.execute","purpose":"execute code in a live Revit model","access":"execute","operations":["execute"],"providers":[{"provider":"Revit-Connector","profile":"Revit/AutoCAD","access":"execute","enabled_by_default":false,"environments":["claude","codex"],"availability":"on-demand"}],"fallback":["return reviewed pyRevit script without execution"],"escalation":"use fallback and hand off when unavailable","verification":{"status":"forward-test","evidence":"Epic 3.1: Codex Desktop read-only inspect smoke passed; execute was not tested"}},
    {"capability_id":"revit.modify","purpose":"modify a live Revit model","access":"write","operations":["write","execute","validate"],"providers":[{"provider":"Revit-Connector","profile":"Revit/AutoCAD","access":"write","enabled_by_default":false,"environments":["claude","codex"],"availability":"on-demand"}],"fallback":["return reviewed change plan without model mutation"],"escalation":"use fallback and hand off when unavailable","verification":{"status":"forward-test","evidence":"Epic 3.1: Codex Desktop read-only inspect smoke passed; model modification was not tested"}},
    {"capability_id":"pdf.write","purpose":"edit PDF only through an approved provider","access":"write","operations":["write","validate"],"providers":[],"fallback":["return edit plan and report blocked provider"],"escalation":"use fallback and hand off when unavailable","verification":{"status":"blocked","evidence":"no approved PDF edit provider"}},